{
  "source": "https://www.w3.org/TR/WCAG21/",
  "source_date": "06 May 2025",
  "copyright": "Copyright © W3C® (MIT, ERCIM, Keio, Beihang). Criterion text quoted from the WCAG 2.1 Recommendation under the W3C Document License.",
  "license": "https://www.w3.org/copyright/document-license-2023/",
  "criteria": [
    {
      "id": "1.1.1",
      "name": "Non-text Content",
      "level": "A",
      "text": "All non-text content that is presented to the user has a text alternative that serves the equivalent purpose, except for the situations listed below.\n- Controls, Input: If non-text content is a control or accepts user input, then it has a name that describes its purpose. (Refer to Success Criterion 4.1.2 for additional requirements for controls and content that accepts user input.)\n- Time-Based Media: If non-text content is time-based media, then text alternatives at least provide descriptive identification of the non-text content. (Refer to Guideline 1.2 for additional requirements for media.)\n- Test: If non-text content is a test or exercise that would be invalid if presented in text, then text alternatives at least provide descriptive identification of the non-text content.\n- Sensory: If non-text content is primarily intended to create a specific sensory experience, then text alternatives at least provide descriptive identification of the non-text content.\n- CAPTCHA: If the purpose of non-text content is to confirm that content is being accessed by a person rather than a computer, then text alternatives that identify and describe the purpose of the non-text content are provided, and alternative forms of CAPTCHA using output modes for different types of sensory perception are provided to accommodate different disabilities.\n- Decoration, Formatting, Invisible: If non-text content is pure decoration, is used only for visual formatting, or is not presented to users, then it is implemented in a way that it can be ignored by assistive technology.",
      "understanding": "https://www.w3.org/WAI/WCAG21/Understanding/non-text-content.html"
    },
    {
      "id": "1.2.1",
      "name": "Audio-only and Video-only (Prerecorded)",
      "level": "A",
      "text": "For prerecorded audio-only and prerecorded video-only media, the following are true, except when the audio or video is a media alternative for text and is clearly labeled as such:\n- Prerecorded Audio-only: An alternative for time-based media is provided that presents equivalent information for prerecorded audio-only content.\n- Prerecorded Video-only: Either an alternative for time-based media or an audio track is provided that presents equivalent information for prerecorded video-only content.",
      "understanding": "https://www.w3.org/WAI/WCAG21/Understanding/audio-only-and-video-only-prerecorded.html"
    },
    {
      "id": "1.2.2",
      "name": "Captions (Prerecorded)",
      "level": "A",
      "text": "Captions are provided for all prerecorded audio content in synchronized media, except when the media is a media alternative for text and is clearly labeled as such.",
      "understanding": "https://www.w3.org/WAI/WCAG21/Understanding/captions-prerecorded.html"
    },
    {
      "id": "1.2.3",
      "name": "Audio Description or Media Alternative (Prerecorded)",
      "level": "A",
      "text": "An alternative for time-based media or audio description of the prerecorded video content is provided for synchronized media, except when the media is a media alternative for text and is clearly labeled as such.",
      "understanding": "https://www.w3.org/WAI/WCAG21/Understanding/audio-description-or-media-alternative-prerecorded.html"
    },
    {
      "id": "1.2.4",
      "name": "Captions (Live)",
      "level": "AA",
      "text": "Captions are provided for all live audio content in synchronized media.",
      "understanding": "https://www.w3.org/WAI/WCAG21/Understanding/captions-live.html"
    },
    {
      "id": "1.2.5",
      "name": "Audio Description (Prerecorded)",
      "level": "AA",
      "text": "Audio description is provided for all prerecorded video content in synchronized media.",
      "understanding": "https://www.w3.org/WAI/WCAG21/Understanding/audio-description-prerecorded.html"
    },
    {
      "id": "1.3.1",
      "name": "Info and Relationships",
      "level": "A",
      "text": "Information, structure, and relationships conveyed through presentation can be programmatically determined or are available in text.",
      "understanding": "https://www.w3.org/WAI/WCAG21/Understanding/info-and-relationships.html"
    },
    {
      "id": "1.3.2",
      "name": "Meaningful Sequence",
      "level": "A",
      "text": "When the sequence in which content is presented affects its meaning, a correct reading sequence can be programmatically determined.",
      "understanding": "https://www.w3.org/WAI/WCAG21/Understanding/meaningful-sequence.html"
    },
    {
      "id": "1.3.3",
      "name": "Sensory Characteristics",
      "level": "A",
      "text": "Instructions provided for understanding and operating content do not rely solely on sensory characteristics of components such as shape, color, size, visual location, orientation, or sound.",
      "understanding": "https://www.w3.org/WAI/WCAG21/Understanding/sensory-characteristics.html"
    },
    {
      "id": "1.3.4",
      "name": "Orientation",
      "level": "AA",
      "text": "Content does not restrict its view and operation to a single display orientation, such as portrait or landscape, unless a specific display orientation is essential.",
      "understanding": "https://www.w3.org/WAI/WCAG21/Understanding/orientation.html"
    },
    {
      "id": "1.3.5",
      "name": "Identify Input Purpose",
      "level": "AA",
      "text": "The purpose of each input field collecting information about the user can be programmatically determined when:\n- The input field serves a purpose identified in the Input Purposes for user interface components section; and\n- The content is implemented using technologies with support for identifying the expected meaning for form input data.",
      "understanding": "https://www.w3.org/WAI/WCAG21/Understanding/identify-input-purpose.html"
    },
    {
      "id": "1.4.1",
      "name": "Use of Color",
      "level": "A",
      "text": "Color is not used as the only visual means of conveying information, indicating an action, prompting a response, or distinguishing a visual element.",
      "understanding": "https://www.w3.org/WAI/WCAG21/Understanding/use-of-color.html"
    },
    {
      "id": "1.4.2",
      "name": "Audio Control",
      "level": "A",
      "text": "If any audio on a web page plays automatically for more than 3 seconds, either a mechanism is available to pause or stop the audio, or a mechanism is available to control audio volume independently from the overall system volume level.",
      "understanding": "https://www.w3.org/WAI/WCAG21/Understanding/audio-control.html"
    },
    {
      "id": "1.4.3",
      "name": "Contrast (Minimum)",
      "level": "AA",
      "text": "The visual presentation of text and images of text has a contrast ratio of at least 4.5:1, except for the following:\n- Large Text: Large-scale text and images of large-scale text have a contrast ratio of at least 3:1;\n- Incidental: Text or images of text that are part of an inactive user interface component, that are pure decoration, that are not visible to anyone, or that are part of a picture that contains significant other visual content, have no contrast requirement.\n- Logotypes: Text that is part of a logo or brand name has no contrast requirement.",
      "understanding": "https://www.w3.org/WAI/WCAG21/Understanding/contrast-minimum.html"
    },
    {
      "id": "1.4.4",
      "name": "Resize Text",
      "level": "AA",
      "text": "Except for captions and images of text, text can be resized without assistive technology up to 200 percent without loss of content or functionality.",
      "understanding": "https://www.w3.org/WAI/WCAG21/Understanding/resize-text.html"
    },
    {
      "id": "1.4.5",
      "name": "Images of Text",
      "level": "AA",
      "text": "If the technologies being used can achieve the visual presentation, text is used to convey information rather than images of text except for the following:\n- Customizable: The image of text can be visually customized to the user's requirements;\n- Essential: A particular presentation of text is essential to the information being conveyed.",
      "understanding": "https://www.w3.org/WAI/WCAG21/Understanding/images-of-text.html"
    },
    {
      "id": "1.4.10",
      "name": "Reflow",
      "level": "AA",
      "text": "Content can be presented without loss of information or functionality, and without requiring scrolling in two dimensions for:\n- Vertical scrolling content at a width equivalent to 320 CSS pixels;\n- Horizontal scrolling content at a height equivalent to 256 CSS pixels.\nExcept for parts of the content which require two-dimensional layout for usage or meaning.",
      "understanding": "https://www.w3.org/WAI/WCAG21/Understanding/reflow.html"
    },
    {
      "id": "1.4.11",
      "name": "Non-text Contrast",
      "level": "AA",
      "text": "The visual presentation of the following have a contrast ratio of at least 3:1 against adjacent color(s):\n- User Interface Components: Visual information required to identify user interface components and states, except for inactive components or where the appearance of the component is determined by the user agent and not modified by the author;\n- Graphical Objects: Parts of graphics required to understand the content, except when a particular presentation of graphics is essential to the information being conveyed.",
      "understanding": "https://www.w3.org/WAI/WCAG21/Understanding/non-text-contrast.html"
    },
    {
      "id": "1.4.12",
      "name": "Text Spacing",
      "level": "AA",